{"codec":{"formats":["ternary","2bit","4bit"],"fp16_max":65504.0,"fp16_min":6.103515625e-05,"log_steps_per_octave":16,"mult_2bit":1.135,"mult_4bit":0.42,"scale_policies":["row16","row8log","tensor16"]},"model":{"gelu_approximate":"none","mlps":["gelu","relu2","swiglu"],"rmsnorm_eps":1.1920928955078125e-07,"rope_theta":10000.0,"tensor_layout":[{"cols":"d","name":"emb.weight","norm":false,"per_block":false,"rows":"vocab"},{"cols":"d","name":"blocks.{i}.norm1.weight","norm":true,"per_block":true,"rows":"1"},{"cols":"d","name":"blocks.{i}.qkv.weight","norm":false,"per_block":true,"rows":"3*d"},{"cols":"d","name":"blocks.{i}.proj.weight","norm":false,"per_block":true,"rows":"d"},{"cols":"d","name":"blocks.{i}.norm2.weight","norm":true,"per_block":true,"rows":"1"},{"cols":"d","name":"blocks.{i}.fc.weight","norm":false,"per_block":true,"rows":{"gelu":"d_ff","relu2":"d_ff","swiglu":"2*d_ff"}},{"cols":"d_ff","name":"blocks.{i}.fc2.weight","norm":false,"per_block":true,"rows":"d"},{"cols":"d","name":"norm.weight","norm":true,"per_block":false,"rows":"1"}]},"optimizer":{"adamw_betas":[0.9,0.95],"adamw_eps":1e-08,"grad_clip":1.0,"grad_clip_eps":1e-06},"schedule":{"branches":3,"cooldown_frac":0.1,"warmup_frac":0.02},"schema":"floppylm.e0.constants.v1"}
